{
	"$schema": "https://json-schema.org/draft/2020-12/schema",
	"type": "object",
	"required": [],
	"properties": {
		"slug": {
			"type": "string"
		},
		"title": {
			"type": "string"
		},
		"description": {
			"type": "string"
		},
		"yield": {
			"type": "string"
		},
		"ingredients": {
			"type": "array",
			"items": {"$ref": "#/$defs/ingredient"}
		},
		"steps": {
			"type": "array"
		},
		"notes": {
			"type": "array"
		}
	},
	"$defs": {
		"ingredient": {
			"type": "object",
			"properties": {
				"amount": {
					"type": "number"
				},
				"unit": {
					"type": "string"
				},
				"name": {
					"type": "string"
				},
				"notes": {
					"type": "string"
				}
			}
		}
	}
}