{
	"$schema": "./recipe.schema.json",
	"slug": "chocolate-chip-cookies",
	"title": "chocolate chip cookies",
	"ingredients": [
		{
			"amount": 1,
			"unit": "c",
			"name": "butter",
			"notes": "softened"
		},
		{
			"amount": 0.5,
			"unit": "c",
			"name": "white sugar"
		},
		{
			"amount": 0.5,
			"unit": "c",
			"name": "brown sugar"
		},
		{
			"amount": 2,
			"unit": "",
			"name": "eggs"
		},
		{
			"amount": 1,
			"unit": "tsp",
			"name": "vanilla extract"
		},
		{
			"amount": 1,
			"unit": "tsp",
			"name": "salt"
		},
		{
			"amount": 1,
			"unit": "tsp",
			"name": "baking soda"
		},
		{
			"amount": 2.5,
			"unit": "c",
			"name": "all-purpose flour"
		},
		{
			"amount": 2,
			"unit": "c",
			"name": "chocolate chips"
		}
	],
	"steps": [
		"Preheat oven to 350Â°F",
		"Cream together brown sugar, white sugar, and butter",
		"Add eggs and vanilla",
		"Combine flour, baking soda, and salt. Gradually stir into creamed mixture.",
		"Fold in chocolate chips.",
		"Using a scoop or rounded spoon, drop onto cookie sheet.",
		"Bake 8-10 minutes until light brown>"
	],
	"notes": []
}