{
	"$schema": "./recipe.schema.json",
	"slug": "vanishing-oatmeal-cookies",
	"title": "vanishing oatmeal cookies",
	"ingredients": [
		{
			"amount": 0.5,
			"unit": "c + 6 Tbsp",
			"name": "butter",
			"notes": "softened"
		},
		{
			"amount": 0.75,
			"unit": "c",
			"name": "brown sugar",
			"notes": "firmly packed"
		},
		{
			"amount": 0.5,
			"unit": "c",
			"name": "white granulated sugar"
		},
		{
			"amount": 2,
			"unit": "",
			"name": "eggs"
		},
		{
			"amount": 1,
			"unit": "tsp",
			"name": "vanilla extract"
		},
		{
			"amount": 1.5,
			"unit": "c",
			"name": "all-purpose flour"
		},
		{
			"amount": 1,
			"unit": "tsp",
			"name": "baking soda"
		},
		{
			"amount": 1,
			"unit": "tsp",
			"name": "ground cinnamon"
		},
		{
			"amount": 3,
			"unit": "c",
			"name": "rolled oats"
		},
		{
			"amount": 0.5,
			"unit": "tsp",
			"name": "salt",
			"notes": "optional"
		},
		{
			"amount": 1,
			"unit": "c",
			"name": "raisins",
			"notes": "if you're weird"
		}
	],
	"steps": [
		"Preheat oven to 350Â°F.",
		"Line baking sheet with parchment paper or silicone baking mat.",
		"Cream together butter, brown sugar, and white sugar.",
		"Add eggs and vanilla.",
		"Combine flour, baking soda, cinnamon, and salt. Gradually stir into creamed mixture.",
		"Add oats and raisins; mix well.",
		"Using a scoop or rounded spoon, drop onto cookie sheet.",
		"Bake 8-10 minutes or until light golden brown.",
		"Let cool 2-3 mins before moving to wire rack."
	],
	"notes": []
}