{
	"$schema": "./recipe.schema.json",
	"slug": "recipe-name",
	"title": "recipe name",
	"ingredients": [
		{
			"amount": 1.5,
			"unit": "c",
			"name": "vanilla extract",
			"notes": "softened"
		},
		{
			"amount": 1.5,
			"unit": "c",
			"name": "vanilla extract"
		},
		{
			"amount": 1.5,
			"unit": "c",
			"name": "vanilla extract"
		},
		{
			"amount": 1.5,
			"unit": "c",
			"name": "vanilla extract"
		},
		{
			"amount": 1.5,
			"unit": "c",
			"name": "vanilla extract"
		},
		{
			"amount": 1.5,
			"unit": "c",
			"name": "vanilla extract"
		},
		{
			"amount": 1.5,
			"unit": "c",
			"name": "vanilla extract"
		},
		{
			"amount": 1.5,
			"unit": "c",
			"name": "vanilla extract"
		},
		{
			"amount": 1.5,
			"unit": "c",
			"name": "vanilla extract"
		},
		{
			"amount": 1.5,
			"unit": "c",
			"name": "vanilla extract"
		}
	],
	"steps": [
		"Preheat oven to 350°F",
		"Preheat oven to 350°F",
		"Preheat oven to 350°F",
		"Preheat oven to 350°F",
		"Preheat oven to 350°F",
		"Preheat oven to 350°F",
		"Preheat oven to 350°F",
		"Preheat oven to 350°F",
		"Preheat oven to 350°F"
	],
	"notes": []
}